contents,date,day,month,related,title,year
Null Contents,00000000,00,00,"[""Null"",""Null""]",Null Title,0000
操盘攻略最新股市投资日历，密尔克卫7月4日申购。点击查看最新鲜的新股资讯新股申购表新股上会情况一览表新的一周(2018年7月2日2018年7月8日)重要数据主要集中在中国和美国，同时，全球多个主要经济体均将公布制造业PMI数据。此外，美联储将公布6月会议纪要，澳洲联储也将召开议息会议，一些主要央行官员将出席活动并发表讲话。刚刚公布的美国一季度GDP年化季率终值录得2%低于2.2%的前值和预期，另外，个人消费支出的表现录得近5年来最差水平。这显然与特朗普之前暗示的二季度GDP增速超过4%不相符。数据公布后，一度引发了市场对于美国税改红利和财政刺激政策难以抵消贸易摩擦负面因素的担忧，美指小幅下跌。本周，标普500指数累跌1.33%，道指累跌1.26%——连跌三周、为逾近两年来首次出现，纳指累跌2.37%。目前，美国股市见证了一波9年大牛市，离历史高点仅有几个百分点之遥。2018年上半年，标普500指数累涨1.67%，道指累跌1.81%，纳指累涨8.79%。但华尔街著名对冲基金经理鲍尔森(JimPaulsen)却提出质疑，告诫投资者需注意这两个危险迹象。目前全球系统重要性银行(GSIB)股价处于14个月低点，落入熊市区间，美国各项经济数据也不及预期；同时，越来越多领先市场的股票属于进取型、高beta值的股票，而标普500指数里的保守型股票数量已处于历史最低水平。鲍尔森警告称，美股目前的情况与互联网泡沫破裂、亚洲金融危机和俄罗斯经济崩溃前的1997年如出一辙。今年将有50%的可能出现15%的抛售。如果股市在未来某个时候跌破2月份的低点，届时被大量抛售的，可能正是这些所有投资者都持有的热门股票。由于美元指数自高位回落，金价得到提振，小幅收涨，结束了之前连续四日下跌的走势。黄金本周累跌1.3%，6月份累跌3.8%，2018年上半年累跌逾4%。原油市场方面，因利比亚原油供应继续受阻，贝克休斯石油钻井机数继续下降，国际油价本周录得四连涨。周五美油创2014年11月份以来收盘新高，2018年迄今累涨将近23%；布油创5月份以来收盘新高，向80美元大关发起冲击，上半年累涨18.8%。展望下周，全球将聚焦美联储将在周四(7月5日)公布会议记录，以及定于周五(7月6日)关公布的6月美国非农就业人数。分析师们将仔细研究美联储的措辞，以查看美联储主席鲍威尔是否像市场所认为的那样强硬，因为美联储今年暗示将再加息两次。凯透宏观分析师SimonaGambarini指出：“关注所使用的语言是否有变化，以及在今年剩下的时间里通胀和利率将表现如何，这将是一件很有趣的事情。如果有迹象表明美联储担心通胀，那将对金价有利。”全球央行方面，澳洲联储将公布新一期利率决议，目前市场广泛预期，澳洲联储将继续维持1.5%的现金利率不变。受全球贸易经济体之间贸易摩擦影响，澳洲联储料很难跟随美联储加息。中国数据方面，6月财新制造业PMI及服务业PMI将相继公布，中国财新制造业PMI仍处于荣枯线50上方，但从过去10个月的数据走势看，中国制造业扩张势头相对温和。本文仅供投资者参考，不构成投资建议。点击查看新股申购表上会表1分钟股票在线开户，使用一键打新，告别打新繁琐流程,20180701,01,07,"[]",最新股市投资日历：密尔克卫7月4日申购(附解禁股名单),2018
个税法自1980年出台以来迎来了第七次大修，近日《个人所得税法修正案(草案)》提请十三届全国人大常委会第三次会议审议。从已公布的税改草案看，不仅包括基本减除费用标准从每月3500元提高至每月5000元，更重要的是提出了很多有突破性的改革内容。此前5月国家统计局公布了全国各省平均工资，那么如果本次税改通过后，对各地企业和个人有多大影响？接受中国经济导报记者采访的业内人士表示，从全国来看，基本减除费用标准从每月3500元提高至每月5000元是合理的，也有称对于北上广深一线城市，以及东部一些发达省市，每月5000元还是偏低，建议提至1万元。个人少缴税，企业降税负贾总是吉林市一家中小民营企业负责人，“我们是一家智能水表企业，员工20人。这里起底工资1800元，最高工资4500元，从每月3500元调至每月5000元，对我们企业来说是极大的利好。对我们小企业来说，小规模企业税率10%。我们企业月均销售额40万元，原材料等成本24万元，雇佣了20名员工，月工资3500元以上就需要缴税的话，那么人工费以7万元来算，扣除原材料成本和人工费，最后剩下9万元需要纳税9000元。如果调至每人工资每月5000元的话，人工成本超过10万元部分才需要纳税，同样扣除原材料等剩下6万元需要纳税6000元，每月少缴税3000元，对我们这些做实业的中小企业来说，是极大的鼓励。”不过，也有企业表示，基本减除费用的标准每月5000元还是比预期低了一些。仁卅信息科技(上海)有限公司CEO宋孔尧告诉中国经济导报记者，“从每月3500元提高到每月5000元对我们来说，也没有太大的影响。上海工资高，生活成本也高，个税调整还是需要考虑地区差异，个人以为，应提高到8000元。”业内人士指出，从全国来看，基本减除费用标准从每月3500元提高至每月5000元是合理的。根据国家统计局5月中旬公布的数据，2017年全国城镇非私营单位就业人员年平均工资为74318元(月平均工资6193元)，城镇私营单位就业人员年平均工资为45761元(月平均工资3813元)。“1万元月薪按照现行累进税率计算，预计每月可省下150元。”梁先生目前是武汉光谷一家软件企业经理，他表示，“武汉的生活成本不高，人均工资在每月5000元到每月7000元左右，每月5000元的标准很不错。”“从每月3500元提高到每月5000元，提高幅度达到40%以上，改革力度较大，触及面广，凸显了公平合理的原则。”据西南财经大学经济与管理研究院院长甘犁测算，全国纳税总额将减少1720亿元。但税收减少只是暂时的，随着人民收入水平的提高，预计明年纳税总额即恢复到当前水平，纳税人口也将在几年后恢复至当前水平。综合征税取得大突破我国一直以来采用的分类所得税制虽然有计征简单的优点，但随着社会经济的快速发展，其难以全面衡量纳税人真实纳税能力的弊端日益明显，并且容易造成纳税人通过分散收入逃避税收，进而打击税收公平。根据税改草案说明，此次改革将4项劳动性所得(“工资、薪金所得”、“劳务报酬所得”、“稿酬所得”、“特许权使用费所得”)纳入综合征税范围。“这标志着在酝酿多年之后，个税在逐步建立综合与分类相结合的个人所得税制的道路上迈出重要的第一步。所得类型的综合简并主要体现在劳动性所得。综合所得税率级距调整，特别是较低档税率收入级距的扩大，将使以工资薪金为主要收入的纳税人切身感受到税负的降低，其中中低收入工薪族将成为最大的受益者。”普华永道个人所得税服务团队分析师朱锦华告诉中国经济导报记者。随着我国社会经济的快速发展，不同地区、不同家庭情况的纳税人的实际生活支出种类和水平出现很大差异，单一费用减除额(例如工资、薪金所得计税时每月3500元的扣除额)的局限性日益明显。“忽视纳税人个体差异，持续提高单一额度基本减除费用标准已无法助力税收公平。与此同时，综合和分类相结合的个税制度要求建立相应的以实际民生负担为基础的综合弹性扣除机制，以体现和促进税收公平。”朱锦华说。涉外税政变化受“走出去”企业关注朱锦华表示，此次税改草案说明传递的重磅信息之一——涉外税收政策的变化也非常值得关注。比如“183天”的居民/非居民判定标准的变化是否预示着对现行的涉外税收政策的全面修订，居民/非居民定义的明确是否意味着无住所个人在华停留满5年才负有全球纳税义务的规定也将有所变化等。“此外，这些变化也将影响企业的全球派遣安排政策及派遣成本。”值得注意的是，随着越来越多的中国企业“走出去”，赴境外工作的中国员工人数不断增加，实践中企业和个人往往面临着更高的个税成本。朱锦华认为，现行税法对于“走出去”个人税收的相关规定十分有限，从政策支持到征管流程都相对滞后。在后续的涉外税收政策完善过程中能否针对“走出去”企业和个人做出特别的安排，带来利好消息，也是很多企业关注的问题。,20180628,28,06,"[]",个税税制终突破 企业个人影响几何,2018
6月28日消息，财政部、税务总局日前下达通知，为助力经济高质量发展，2018年将对部分行业增值税期末留抵税额予以退还。先进制造业、研发等现代服务业和电网企业将受惠。先进制造业、现代服务业、电网企业受惠按照通知的划定，退还增值税期末留抵税额的行业包括装备制造等先进制造业、研发等现代服务业和电网企业。其中装备制造等先进制造业和研发等现代服务业，包括专用设备制造业、研究和试验发展等18个大类行业，并优先选择以下范围内的纳税人：新一代信息技术、高档数控机床和机器人、航空航天装备、海洋工程装备及高技术船舶、先进轨道交通装备、节能与新能源汽车、电力装备、农业机械装备、新材料、生物医药及高性能医疗器械等10个重点领域、高新技术企业、技术先进型服务企业和科技型中小企业。退还期末留抵税额的纳税人条件设定为：纳税信用等级须为A级或B级。各地纳税人名单9月前上报关于退还期末留抵税额的计算，通知规定，纳税人向主管税务机关申请退还期末留抵税额，当期退还的期末留抵税额，以纳税人申请退税上期的期末留抵税额和退还比例计算，并以纳税人2017年底期末留抵税额为上限。通知要求各省、自治区、直辖市、计划单列市根据财政部和税务总局确定的各省2018年装备制造等先进制造业、研发等现代服务业退还期末留抵税额规模，顺应国家宏观政策导向，兼顾不同规模、类型企业，确定本省退还期末留抵税额的纳税人，于2018年8月31日前将纳税人名单及拟退税金额报财政部和税务总局备案。,20180628,28,06,"[""专用设备"",""机器人""]",两部门再推退税新政 先进制造业、研发等18类行业将受惠,2018
28日，重庆市政府办公厅印发了《关于进一步加强房地产市场调控工作的通知》。通过出台一系列措施，重庆将进一步加强房地产调控。其中，明确支持刚性居住需求与坚决遏制投机炒房并举是重点。通知明确了八项措施，涵盖了落实责任、土地、金融、定价指导、规划引导、发展租赁住房等调控措施，是一次系统调控，有别于一般“打补丁式”的调控举措。,20180628,28,06,"[""房地产""]",重庆再出“组合拳”打击炒房,2018
发改委网站29日消息，近日，市场传言发展改革委正考虑禁止企业发行364天期美元债，以防范风险。发改委表示，据了解，国家发展改革委等国务院有关部门并未考虑禁止企业境外发债，以上传言没有依据。,20180629,29,06,"[]",发改委：有关部门并未考虑禁止企业境外发债,2018
